id	source_product_card_id	source_category	source_name	source_url	retrieval_query_or_path	observed_at	revisit_cadence	stored_evidence_summary	evidence_strength
archive_github_paper_qa	github_paper_qa	github_rising	github_rising	https://github.com/Future-House/paper-qa	github_rising	2026-07-08T00:00:00.000Z	weekly	A question plus a folder of scientific PDFs in; a cited, evidence-ranked answer out.	medium
archive_github_podcastfy	github_podcastfy	github_rising	github_rising	https://openpod.fly.dev	github_rising	2026-07-08T00:00:00.000Z	weekly	URLs, PDFs, images, or videos in; a two-voice conversational podcast audio file out.	medium
archive_github_hivision_id_photos	github_hivision_id_photos	github_rising	github_rising	https://github.com/Zeyi-Lin/HivisionIDPhotos	github_rising	2026-07-08T00:00:00.000Z	weekly	A casual selfie in; standards-compliant ID photos with chosen background colors and print layouts out.	medium
archive_github_talemate	github_talemate	github_rising	github_rising	https://github.com/vegu-ai/talemate	github_rising	2026-07-08T00:00:00.000Z	weekly	Player actions and scenario definitions in; a coherent, long-running interactive narrative with consistent world state out.	medium
archive_github_actual_ai	github_actual_ai	github_rising	github_rising	https://github.com/sakowicz/actual-ai	github_rising	2026-07-08T00:00:00.000Z	weekly	Uncategorized bank transactions in; LLM-assigned budget categories with review tags out.	medium
archive_github_open_notebook	github_open_notebook	github_rising	github_rising	https://github.com/lfnovo/open-notebook	github_rising	2026-07-08T00:00:00.000Z	weekly	Mixed research materials in; grounded chat, notes, citations, and custom multi-speaker podcasts out.	medium
archive_github_storm	github_storm	github_rising	github_rising	https://storm.genie.stanford.edu	github_rising	2026-07-08T00:00:00.000Z	weekly	A topic query in; a full-length, citation-grounded Wikipedia-style article with hierarchical outline out.	medium
archive_devpost_nutshell_hands_free_web	devpost_nutshell_hands_free_web	hackathon_demo	hackathon_demo	https://devpost.com/software/nutshell-auftp2	hackathon_demo	2026-07-08T00:00:00.000Z	weekly	User moves their head and opens their mouth in front of a webcam; the browser cursor moves, clicks, scrolls, and long pages/videos get AI summaries.	high
archive_devpost_aac_board_ai	devpost_aac_board_ai	hackathon_demo	hackathon_demo	https://aacboard.app	hackathon_demo	2026-07-08T00:00:00.000Z	weekly	User taps pictograms on a communication board; out comes a grammatically complete, tone-matched sentence spoken aloud in the chosen language.	high
archive_devpost_phonaify	devpost_phonaify	hackathon_demo	hackathon_demo	https://devpost.com/software/phonaify	hackathon_demo	2026-07-08T00:00:00.000Z	weekly	User highlights a word and speaks it; the extension returns correct audio plus a phoneme-level diff of what they got wrong.	high
archive_devpost_pet_shelter_app	devpost_pet_shelter_app	hackathon_demo	hackathon_demo	https://petshelter.app	hackathon_demo	2026-07-08T00:00:00.000Z	weekly	Shelter staff upload a pet photo and rough notes; out comes a professionally written, proofread, multi-language adoption profile in a public gallery.	high
archive_devpost_trail_offline_companion	devpost_trail_offline_companion	hackathon_demo	hackathon_demo	https://www.trailplanner101.com	hackathon_demo	2026-07-08T00:00:00.000Z	weekly	User plans a route online; on the trail with no signal, they get an offline map with GPS position plus a local AI that answers safety and nature questions.	high
archive_devpost_eduadapt	devpost_eduadapt	hackathon_demo	hackathon_demo	https://devpost.com/software/eduadapt	hackathon_demo	2026-07-08T00:00:00.000Z	weekly	Teacher/parent sets a student profile (grade, diagnosis, support level); any webpage the child opens is reformatted into simplified, structured, checklist-supported reading.	high
archive_devpost_the_turing_werewolf	devpost_the_turing_werewolf	hackathon_demo	hackathon_demo	https://ang-rui-yan.github.io/the-turing-werewolf/	hackathon_demo	2026-07-08T00:00:00.000Z	weekly	User joins a Werewolf lobby of local AI players and types accusations/defenses; the AI villagers argue back, form suspicions, and vote to eliminate suspects.	high
archive_devpost_hawkwatch	devpost_hawkwatch	hackathon_demo	hackathon_demo	https://devpost.com/software/hawkwatch	hackathon_demo	2026-07-08T00:00:00.000Z	weekly	User connects live camera streams or MP4s; the system returns real-time alerts with incident timelines, security reports, and CSV exports when it detects crime or medical distress.	high
archive_devpost_fridgefit	devpost_fridgefit	hackathon_demo	hackathon_demo	https://fridgefit.netlify.app	hackathon_demo	2026-07-08T00:00:00.000Z	weekly	User photographs their fridge and picks a fitness goal; out come three meal options with recipes and calorie/protein/carb/fat macros.	high
archive_devpost_shot_analyzer	devpost_shot_analyzer	hackathon_demo	hackathon_demo	https://devpost.com/software/shot-anazlyer	hackathon_demo	2026-07-08T00:00:00.000Z	weekly	User uploads a jump-shot video; out comes frame-level pose-based feedback on each shot phase plus longitudinal trend charts across all past uploads.	high
archive_devpost_carboncompass	devpost_carboncompass	hackathon_demo	hackathon_demo	https://devpost.com/software/carboncompass-hyqob0	hackathon_demo	2026-07-08T00:00:00.000Z	weekly	User types a business concept into chat; out comes a ranked, color-coded 3D map of neighborhoods with sustainability scores and rationale.	high
archive_calhacks_facetimeos	calhacks_facetimeos	hackathon_demo	hackathon_demo	https://blog.dylanlu.com/cal-hacks-12/	hackathon_demo	2026-07-08T00:00:00.000Z	weekly	User FaceTime-calls their Mac and says what they need done; the agent clicks and types through the task while narrating progress back over the call.	medium
archive_treehacks_ecobite	treehacks_ecobite	hackathon_demo	hackathon_demo	https://sites.duke.edu/dkuhumanities/dku-student-wins-first-place-at-stanford-hackathon-with-app-to-fight-food-waste/	hackathon_demo	2026-07-08T00:00:00.000Z	weekly	User photographs food they are discarding; the app estimates waste weight and accumulates a personal waste-tracking record.	medium
archive_treehacks_hivemind	treehacks_hivemind	hackathon_demo	hackathon_demo	https://cob.news.niu.edu/2025/05/14/mis-student-samarth-shiramshetty-wins-grand-prize-in-education-at-stanford-universitys-treehacks/	hackathon_demo	2026-07-08T00:00:00.000Z	weekly	Class runs on Zoom as usual; the system ingests quizzes and transcripts, flags who is falling behind, and outputs dynamically matched peer support groups.	medium
archive_hackharvard_halo	hackharvard_halo	hackathon_demo	hackathon_demo	https://www.dtnext.in/news/chennai/chennai-born-twins-turn-ai-innovators-win-global-hackharvard-2025-with-life-saving-app-halo-849210	hackathon_demo	2026-07-08T00:00:00.000Z	weekly	In an emergency, the user points their iPhone at the scene; Halo overlays step-by-step AR visual guides and speaks instructions for actions like CPR in real time.	medium
archive_junction_apprenticecircle_plus	junction_apprenticecircle_plus	hackathon_demo	hackathon_demo	https://www.aalto.fi/en/news/aalto-students-and-researchers-shape-together-how-we-age-with-ai-at-junction-hackathon-2025	hackathon_demo	2026-07-08T00:00:00.000Z	weekly	A senior has one 10-minute phone chat to create a profile; the platform then matches them with young learners for voice-mediated craft and skill apprenticeships.	medium
archive_musicathon_soundclash	musicathon_soundclash	hackathon_demo	hackathon_demo	https://soundclash-production-9c06.up.railway.app/	hackathon_demo	2026-07-08T00:00:00.000Z	weekly	Host picks artists/genres on a TV screen; players' phones become buzzers for AI-narrated lyric mini-games, with scores synced live across the room.	high
archive_truthtell_veristream	truthtell_veristream	hackathon_demo	hackathon_demo	https://www.pib.gov.in/PressReleaseIframePage.aspx?PRID=2119864	hackathon_demo	2026-07-08T00:00:00.000Z	weekly	A live broadcast feed goes in; flagged claims with knowledge-graph-backed verdicts, geographic context, and explainable rationales come out in near real time.	medium
